{
  "format": "taowind.opp.reality-envelope.v0.1",
  "protocol": "opp.chp.v0.1",
  "version": "0.1.0-candidate.1",
  "kind": "protocol",
  "id": "handshake-offer:rncs",
  "status": "candidate",
  "issuedAt": "2026-09-07T09:51:00Z",
  "issuer": {"id": "rncs", "type": "runtime", "displayName": "RNCS"},
  "payload": {
    "phase": "offer",
    "identity": {"id": "rncs", "civilizationType": "runtime", "displayName": "RNCS 现实运行时"},
    "supportedProtocols": ["opp.chp.v0.1", "opp.rcp.v0.1", "opp.rsp.v0.1", "opp.rep.v0.1"],
    "capabilities": ["state.observe", "evidence.emit"],
    "authorityScopes": ["world.observe"],
    "evidencePolicy": {"minimumConfidence": 0.8, "acceptDerivedEvidence": false, "requiredProtocols": ["opp.chp.v0.1", "opp.rep.v0.1"]},
    "extensions": {}
  },
  "constraints": [], "evidenceRefs": [], "extensions": {},
  "integrity": {"algorithm": "sha256", "contentRoot": "fffb26d65e9476e9cab5c2c8780e9b7ae8912be1cc486e2defe26d8fd44a2ccf"}
}
