{
  "format": "taowind.opp.reality-envelope.v0.1",
  "protocol": "opp.rap.v0.1",
  "version": "0.1.0-candidate.1",
  "kind": "protocol",
  "id": "artifact:opp-v0.1",
  "status": "candidate",
  "issuedAt": "2026-09-07T09:51:00Z",
  "issuer": {"id": "opp-runtime", "type": "runtime", "displayName": "opp-runtime"},
  "payload": {
    "artifactId": "opp-v0.1",
    "artifactType": "protocol-suite",
    "purpose": "把 TaoWind 协议原语收束成开放现实协议候选。",
    "version": "0.1.0-candidate.1",
    "contentRef": "repository://xingxuling/OPP",
    "contentRoot": null,
    "dependencies": ["rcl", "rncs", "dwac"],
    "provenance": [
      {"source": "RCL protocol/contract primitives", "relation": "abstracted-from"},
      {"source": "DWAC federation/capability/evidence primitives", "relation": "abstracted-from"}
    ],
    "constraints": ["no-silent-authority-promotion", "candidate-until-verified"],
    "acceptance": [
      {"gate": "json-schema", "status": "pass", "evidenceRef": "local:test_protocols"},
      {"gate": "independent-interoperability", "status": "unverified"}
    ],
    "lifecycle": "candidate",
    "executableSemantics": {"validator": "python -m opp validate"},
    "interfaces": ["opp.cli"],
    "evidenceRefs": ["evidence/DWAC_COLLABORATION_RECEIPT.json"]
  },
  "constraints": [], "evidenceRefs": [], "extensions": {},
  "integrity": {"algorithm": "sha256", "contentRoot": "d262036568f57b70fa7be97f5dc760b2509409afc43aa6f9a180a24c87726f0b"}
}
