{
  "format": "taowind.opp.reality-envelope.v0.1",
  "protocol": "opp.rcp.v0.1",
  "version": "0.1.0-candidate.1",
  "kind": "capability",
  "id": "capability:dwac.structural.whole-artifact.compile.v1",
  "status": "candidate",
  "issuedAt": "2026-09-07T09:51:00Z",
  "issuer": {"id": "dwac", "type": "runtime", "displayName": "dwac"},
  "payload": {
    "capabilityId": "dwac.structural.whole-artifact.compile.v1",
    "name": "Whole Artifact Compile（全工件编译）",
    "domain": "artifact.structure",
    "operation": "compile",
    "inputModalities": ["goal", "context"],
    "outputModalities": ["artifact-graph", "candidate-artifacts"],
    "inputSchema": null,
    "outputSchema": null,
    "determinism": "unknown",
    "statefulness": "session",
    "streaming": false,
    "authorityRequired": ["artifact.structure.compile"],
    "sideEffects": ["workspace.write"],
    "reversibility": "compensatable",
    "availability": "candidate-only",
    "costProfile": {},
    "latencyProfile": {},
    "rights": {},
    "evidence": ["dwac:WORKER_PROTOCOL_v1", "dwac:DWAC_USCE_FEDERATION_CONTRACT_v4"],
    "claimBoundary": "生成候选工件，不自动提升 Canonical 权威。"
  },
  "constraints": [], "evidenceRefs": [], "extensions": {},
  "integrity": {"algorithm": "sha256", "contentRoot": "1f6d104e8ebae4c662f9c2b80927d9f2b7527034c6f57df1eccc96dacddc6496"}
}
